{
  "document_kind": "ocl.entry", "schema_version": "0.1.0",
  "id": "ocl.example.odoo19.account.invoice_salesperson", "type": "field_semantic", "status": "draft", "revision": 1,
  "validity": {"contract_id": "ocl.example.contract", "intended_scope": "stock_build", "guarantee": "candidate", "stock_only": true, "immutable_after_release": true},
  "applies_to": {"odoo_versions": ["19.0"], "editions": ["community", "enterprise"], "requires_modules": ["account"]},
  "claim": {"summary": "Candidate example for explaining a field rather than relying on its label.", "model": "account.move", "field": "invoice_user_id", "meaning": "Salesperson associated with the invoice.", "limitations": ["This public example is not verification evidence."]},
  "evidence": [{"id": "example_docs", "kind": "official_documentation", "locator": "https://www.odoo.com/documentation/19.0/applications/finance/accounting.html"}],
  "assertions": [{"id": "example_field", "kind": "field_exists", "mode": "snapshot", "target": {"model": "account.move", "field": "invoice_user_id"}, "expected": true, "evidence_ids": ["example_docs"]}],
  "confidence": {"score": 0.5, "basis": "format_example_only", "rationale": "Candidate content is not a canonical registry certification."},
  "provenance": {"created_by": "public-spec-examples", "created_at": "2026-07-29", "reviewed_by": [], "change_reason": "Demonstrate field semantic shape."}
}
